{
  "$schema": "https://json-schema.org/draft/2020-12/schema",
  "$id": "https://github.com/mcuadros/paseo-director/engine/domain/configuration/paseo-director.schema.json",
  "title": "Director Organizer Configuration",
  "description": "Closed engine-owned version 1 schema for the paseo-director.json discovery marker.",
  "type": "object",
  "additionalProperties": false,
  "required": [
    "$schema",
    "schemaVersion",
    "project",
    "workspaces",
    "agentProfiles",
    "defaults",
    "workspaceOverrides",
    "skills",
    "templates"
  ],
  "properties": {
    "$schema": {
      "const": "https://github.com/mcuadros/paseo-director/engine/domain/configuration/paseo-director.schema.json"
    },
    "schemaVersion": { "const": 1 },
    "project": { "$ref": "#/$defs/project" },
    "workspaces": {
      "type": "array",
      "minItems": 1,
      "maxItems": 128,
      "items": { "$ref": "#/$defs/workspace" }
    },
    "agentProfiles": { "$ref": "#/$defs/agentProfiles" },
    "defaults": { "$ref": "#/$defs/defaults" },
    "workspaceOverrides": {
      "type": "array",
      "maxItems": 128,
      "items": { "$ref": "#/$defs/workspaceOverride" }
    },
    "skills": {
      "type": "array",
      "minItems": 1,
      "maxItems": 128,
      "items": { "$ref": "#/$defs/fileReference" }
    },
    "templates": {
      "type": "array",
      "minItems": 1,
      "maxItems": 128,
      "items": { "$ref": "#/$defs/fileReference" }
    }
  },
  "$defs": {
    "identifier": {
      "type": "string",
      "minLength": 1,
      "maxLength": 63,
      "pattern": "^[a-z][a-z0-9-]*$"
    },
    "boundedToken": {
      "type": "string",
      "minLength": 1,
      "maxLength": 128,
      "pattern": "^[A-Za-z0-9][A-Za-z0-9._:/-]*$"
    },
    "project": {
      "type": "object",
      "additionalProperties": false,
      "required": ["id", "name"],
      "properties": {
        "id": { "$ref": "#/$defs/identifier" },
        "name": { "type": "string", "minLength": 1, "maxLength": 128 }
      }
    },
    "workspace": {
      "type": "object",
      "additionalProperties": false,
      "required": ["id", "remote", "sourcePath", "defaultBaseBranch"],
      "properties": {
        "id": { "$ref": "#/$defs/identifier" },
        "name": { "type": "string", "minLength": 1, "maxLength": 128 },
        "nativePaseoWorkspaceId": { "type": "string", "minLength": 1, "maxLength": 128 },
        "remote": { "type": "string", "minLength": 1, "maxLength": 2048 },
        "sourcePath": {
          "type": "string",
          "minLength": 2,
          "maxLength": 4096,
          "pattern": "^/"
        },
        "defaultBaseBranch": {
          "type": "string",
          "minLength": 1,
          "maxLength": 255
        }
      }
    },
    "providerOption": {
      "type": "object",
      "additionalProperties": false,
      "required": ["name", "value"],
      "properties": {
        "name": { "enum": ["networkAccess", "nativeWebSearch", "reasoningSummary"] },
        "value": { "$ref": "#/$defs/boundedToken" }
      }
    },
    "mcpCapability": {
      "enum": [
        "project.read",
        "planning.command.submit",
        "task.read",
        "task.outcome.submit",
        "task.helper.request",
        "candidate.read",
        "review.verdict.submit"
      ]
    },
    "agentSelection": {
      "type": "object",
      "additionalProperties": false,
      "required": ["provider", "model", "effort", "mode", "permissionMode", "providerOptions", "mcpCapabilities"],
      "properties": {
        "provider": { "enum": ["codex", "claude-code", "opencode"] },
        "model": { "$ref": "#/$defs/boundedToken" },
        "effort": { "$ref": "#/$defs/boundedToken" },
        "mode": { "$ref": "#/$defs/boundedToken" },
        "permissionMode": { "enum": ["read-only", "workspace-write"] },
        "providerOptions": {
          "type": "array",
          "maxItems": 16,
          "items": { "$ref": "#/$defs/providerOption" }
        },
        "mcpCapabilities": {
          "type": "array",
          "minItems": 1,
          "maxItems": 16,
          "items": { "$ref": "#/$defs/mcpCapability" }
        }
      }
    },
    "agentProfile": {
      "type": "object",
      "additionalProperties": false,
      "required": ["provider", "model", "effort", "mode", "permissionMode", "providerOptions", "mcpCapabilities", "fallbackChain"],
      "properties": {
        "provider": { "enum": ["codex", "claude-code", "opencode"] },
        "model": { "$ref": "#/$defs/boundedToken" },
        "effort": { "$ref": "#/$defs/boundedToken" },
        "mode": { "$ref": "#/$defs/boundedToken" },
        "permissionMode": { "enum": ["read-only", "workspace-write"] },
        "providerOptions": {
          "type": "array",
          "maxItems": 16,
          "items": { "$ref": "#/$defs/providerOption" }
        },
        "mcpCapabilities": {
          "type": "array",
          "minItems": 1,
          "maxItems": 16,
          "items": { "$ref": "#/$defs/mcpCapability" }
        },
        "fallbackChain": {
          "type": "array",
          "maxItems": 8,
          "items": { "$ref": "#/$defs/agentSelection" }
        }
      }
    },
    "agentProfiles": {
      "type": "object",
      "additionalProperties": false,
      "required": ["organizer", "worker", "reviewer"],
      "properties": {
        "organizer": { "$ref": "#/$defs/agentProfile" },
        "worker": { "$ref": "#/$defs/agentProfile" },
        "reviewer": { "$ref": "#/$defs/agentProfile" }
      }
    },
    "limits": {
      "type": "object",
      "additionalProperties": false,
      "required": [
        "maxActiveTasks",
        "maxActiveTasksPerWorkspace",
        "maxConcurrentAgents",
        "maxSubagentsPerTask"
      ],
      "properties": {
        "maxActiveTasks": { "type": "integer", "minimum": 1 },
        "maxActiveTasksPerWorkspace": { "type": "integer", "minimum": 1 },
        "maxConcurrentAgents": { "type": "integer", "minimum": 1 },
        "maxSubagentsPerTask": { "type": "integer", "minimum": 0 }
      }
    },
    "runBudget": {
      "type": "object",
      "additionalProperties": false,
      "required": ["elapsedSeconds", "tokens", "turns", "ciCycles"],
      "properties": {
        "elapsedSeconds": { "type": "integer", "minimum": 1 },
        "tokens": { "type": "integer", "minimum": 1 },
        "turns": { "type": "integer", "minimum": 1, "maximum": 256 },
        "ciCycles": { "type": "integer", "minimum": 1, "maximum": 256 },
        "costMicrousd": { "type": "integer", "minimum": 1 }
      }
    },
    "githubRequiredCheck": {
      "type": "object",
      "additionalProperties": false,
      "required": ["id", "kind", "name"],
      "properties": {
        "id": { "$ref": "#/$defs/identifier" },
        "kind": { "enum": ["check_run", "commit_status"] },
        "name": { "type": "string", "minLength": 1, "maxLength": 200 },
        "appId": { "type": "integer", "minimum": 1 },
        "appSlug": { "$ref": "#/$defs/token" },
        "creatorId": { "type": "integer", "minimum": 1 },
        "creatorLogin": {
          "type": "string",
          "pattern": "^(?:[A-Za-z0-9](?:[A-Za-z0-9-]{0,38})|[A-Za-z0-9][A-Za-z0-9-]{0,38}\\[bot\\])$"
        }
      }
    },
    "githubCi": {
      "type": "object",
      "additionalProperties": false,
      "required": ["workflowId", "workflowName", "cycleRuntimeSeconds", "requiredChecks"],
      "properties": {
        "workflowId": { "type": "integer", "minimum": 1 },
        "workflowName": { "type": "string", "minLength": 1, "maxLength": 200 },
        "cycleRuntimeSeconds": { "type": "integer", "minimum": 1, "maximum": 21600 },
        "requiredChecks": {
          "type": "array",
          "minItems": 1,
          "maxItems": 32,
          "items": { "$ref": "#/$defs/githubRequiredCheck" }
        }
      }
    },
    "defaults": {
      "type": "object",
      "additionalProperties": false,
      "required": [
        "launchPolicy",
        "deliveryMode",
        "limits",
        "runBudget",
        "autoFixCiFailures",
        "autoFixReviewFeedback"
      ],
      "properties": {
        "launchPolicy": { "enum": ["manual", "automatic"] },
        "deliveryMode": { "enum": ["pull_request", "direct"] },
        "integrationMode": { "enum": ["manual", "automatic"], "default": "manual" },
        "limits": { "$ref": "#/$defs/limits" },
        "runBudget": { "$ref": "#/$defs/runBudget" },
        "autoFixCiFailures": { "type": "boolean" },
        "autoFixReviewFeedback": { "type": "boolean" },
        "requireDifferentReviewerModel": { "type": "boolean", "default": false },
        "publishBeforeReview": { "type": "boolean", "default": false },
        "terminateOnCompletion": { "type": "boolean", "default": true },
        "cancellationCleanup": { "enum": ["retain", "snapshot_then_delete"], "default": "snapshot_then_delete" },
        "deleteRemoteTaskBranch": { "type": "boolean", "default": true },
        "recoveryRetentionDays": { "type": "integer", "minimum": 1, "maximum": 7, "default": 7 },
        "githubCi": { "$ref": "#/$defs/githubCi" }
      }
    },
    "workspaceOverride": {
      "type": "object",
      "additionalProperties": false,
      "required": ["workspaceId", "launchPolicy", "deliveryMode"],
      "properties": {
        "workspaceId": { "$ref": "#/$defs/identifier" },
        "launchPolicy": { "enum": ["inherit", "manual", "automatic"] },
        "deliveryMode": { "enum": ["inherit", "pull_request", "direct"] },
        "integrationMode": { "enum": ["inherit", "manual", "automatic"] },
        "maxActiveTasks": { "type": "integer", "minimum": 1 },
        "maxActiveTasksPerWorkspace": { "type": "integer", "minimum": 1 },
        "maxConcurrentAgents": { "type": "integer", "minimum": 1 },
        "maxSubagentsPerTask": { "type": "integer", "minimum": 0 },
        "elapsedSeconds": { "type": "integer", "minimum": 1 },
        "tokens": { "type": "integer", "minimum": 1 },
        "turns": { "type": "integer", "minimum": 1, "maximum": 256 },
        "ciCycles": { "type": "integer", "minimum": 1, "maximum": 256 },
        "costMicrousd": { "type": "integer", "minimum": 0 },
        "autoFixCiFailures": { "type": "boolean" },
        "autoFixReviewFeedback": { "type": "boolean" },
        "requireDifferentReviewerModel": { "type": "boolean" },
        "publishBeforeReview": { "type": "boolean" },
        "terminateOnCompletion": { "type": "boolean" },
        "cancellationCleanup": { "enum": ["inherit", "retain", "snapshot_then_delete"] },
        "deleteRemoteTaskBranch": { "type": "boolean" },
        "recoveryRetentionDays": { "type": "integer", "minimum": 1, "maximum": 7 }
      }
    },
    "fileReference": {
      "type": "object",
      "additionalProperties": false,
      "required": ["id", "path"],
      "properties": {
        "id": { "$ref": "#/$defs/identifier" },
        "path": {
          "type": "string",
          "minLength": 1,
          "maxLength": 512
        }
      }
    }
  }
}
